{
  "version": "storyboard.v1",
  "project_id": "explainer-comic-demo",
  "global": {
    "model": "doubao-seedance-1-5-pro-251215",
    "ratio": "9:16",
    "duration": 5,
    "resolution": "720p",
    "generate_audio": true,
    "return_last_frame": true,
    "service_tier": "default"
  },
  "continuity": {
    "chain_last_frame": true
  },
  "shots": [
    {
      "id": "s01",
      "prompt": "解说漫画风格，雨夜城市远景，镜头推进到主角办公室窗边，紧张氛围，动态光影"
    },
    {
      "id": "s02",
      "prompt": "延续上一镜头，主角转身看向镜头，神情从疑惑到坚定，背景仍是夜雨霓虹"
    },
    {
      "id": "s03",
      "prompt": "延续角色与场景一致性，主角指向屏幕上的关键数据图，镜头轻微推近，漫画分镜感"
    }
  ]
}
